Code,點票站,分區,Counting Station ,District,list1,list2,list3,list4,list5,list6,list7,list8,list9,list10,list11,list12,list13,list14,list15,list16,list17,list18,list19,list20,list21,list22,total,long,lat
Q0101,西貢賽馬會大會堂,西貢區,The Sai Kung Jockey Club Town Hall,SAI KUNG DISTRICT,431,217,8,162,320,345,474,60,95,1085,370,135,86,136,3,15,34,366,228,3,94,81,4748,114.2712298,22.383
Q0102,萬宜漁村公共會堂,西貢區,Man Yee Fishermen Village Community Hall,SAI KUNG DISTRICT,61,38,1,31,44,55,89,11,25,301,26,27,25,28,4,4,8,69,46,0,12,11,916,114.3437366,22.3702485
Q0201,前西貢中心小學,西貢區,Ex-Sai Kung Central Primary School,SAI KUNG DISTRICT,318,171,3,114,243,296,384,46,78,718,341,178,60,129,3,10,27,302,150,0,164,88,3823,114.27632,22.384426
Q0401,港澳信義會小學,西貢區,Hong Kong and Macau Lutheran Church Primary School,SAI KUNG DISTRICT,245,173,4,87,139,178,245,63,55,502,40,119,56,77,1,5,12,209,119,3,216,65,2613,114.266556,22.319474
Q0501,新界西貢坑口區鄭植之中學,西貢區,"Cheng Chek Chee Secondary School of Sai Kung & Hang Hau District, N.T.",SAI KUNG DISTRICT,228,166,6,99,175,202,250,61,64,604,32,113,49,86,5,3,13,238,119,0,132,83,2728,114.2574386,22.34305
Q0601,播道書院,西貢區,Evangel College,SAI KUNG DISTRICT,957,331,5,196,269,352,507,68,132,556,5,139,489,224,5,12,27,422,317,0,246,121,5380,114.2624039,22.3042686
Q0701,香港基督教女青年會將軍澳綜合社會服務處,西貢區,HKYWCA Tseung Kwan O Integrated Social Service Centre,SAI KUNG DISTRICT,976,392,10,125,288,563,630,142,158,529,0,247,95,288,2,8,8,412,169,3,240,143,5428,114.2526791,22.3042551
Q0801,優才(楊殷有娣)書院,西貢區,G.T. (Ellen Yeung) College,SAI KUNG DISTRICT,750,240,5,118,178,281,350,55,105,581,5,156,130,210,1,11,18,297,147,2,176,128,3944,114.2502302,22.3051983
Q0901,香海正覺蓮社佛教正覺中學,西貢區,HHCKLA Buddhist Ching Kok Secondary School,SAI KUNG DISTRICT,427,101,3,222,343,190,316,26,91,724,21,74,251,671,3,9,19,300,326,0,190,134,4441,114.2494052,22.3069753
Q1001,寶覺中學,西貢區,Po Kok Secondary School,SAI KUNG DISTRICT,559,263,6,329,436,388,535,58,126,951,10,161,381,241,13,13,31,469,474,4,267,192,5907,114.2545821,22.3075294
Q1101,博愛醫院八十週年鄧英喜中學,西貢區,POH 80th Anniversary Tang Ying Hei College,SAI KUNG DISTRICT,704,261,7,182,322,471,553,108,162,792,9,212,317,924,8,13,26,429,262,2,243,151,6158,114.2586115,22.308906
Q1201,仁濟醫院王華湘中學,西貢區,YCH Wong Wha San Secondary School,SAI KUNG DISTRICT,937,324,11,216,318,439,581,96,317,831,3,196,244,341,2,14,30,465,401,1,312,156,6235,114.2599926,22.3093092
Q1301,將軍澳運動場,西貢區,Tseung Kwan O Sports Ground,SAI KUNG DISTRICT,714,284,4,114,220,421,466,86,128,486,0,151,132,341,3,10,18,382,189,1,196,119,4465,114.2639618,22.3119259
Q1401,將軍澳官立小學,西貢區,Tseung Kwan O Government Primary School,SAI KUNG DISTRICT,1002,393,7,267,355,598,684,139,207,802,4,253,304,348,3,11,28,514,346,2,268,153,6688,114.2633788,22.3182876
Q1501,翠林體育館,西貢區,Tsui Lam Sports Centre,SAI KUNG DISTRICT,161,53,4,56,72,74,134,7,35,85,1,17,65,104,2,4,3,113,90,0,125,18,1223,114.249523,22.322233
Q1502,景嶺書院,西貢區,King Ling College,SAI KUNG DISTRICT,311,171,4,123,157,191,253,31,73,324,4,79,110,176,3,7,11,222,165,0,269,80,2764,114.2534452,22.3179716
Q1601,翠林社區會堂,西貢區,Tsui Lam Community Hall,SAI KUNG DISTRICT,472,256,4,262,438,408,490,21,143,364,7,124,306,334,5,18,13,486,455,5,967,182,5760,114.248144,22.324369
Q1701,迦密主恩中學,西貢區,Carmel Divine Grace Foundation Secondary School,SAI KUNG DISTRICT,562,282,12,322,512,446,520,37,209,681,19,163,366,497,8,17,44,576,500,4,551,220,6548,114.254608,22.326664
Q1801,寶林邨文娛活動會堂,西貢區,Po Lam Multipurpose Hall,SAI KUNG DISTRICT,749,353,7,259,396,515,671,111,182,808,6,322,300,993,5,11,35,467,365,2,435,209,7201,114.257118,22.324894
Q1901,順德聯誼總會梁潔華小學,西貢區,STFA Leung Kit Wah Primary School,SAI KUNG DISTRICT,897,452,11,315,404,610,620,117,267,900,3,307,275,1418,9,17,44,535,386,0,438,245,8270,114.256037,22.323245
Q1902,順德聯誼總會鄭裕彤中學,西貢區,STFA Cheng Yu Tung Secondary School,SAI KUNG DISTRICT,333,148,7,126,138,237,268,66,110,422,0,130,116,675,1,6,29,216,145,1,136,84,3394,114.2591369,22.3201738
Q2001,景林鄰里社區中心,西貢區,King Lam Neighbourhood Community Centre,SAI KUNG DISTRICT,540,328,10,327,523,394,538,49,185,1334,16,131,411,400,6,21,27,544,461,2,250,133,6630,114.260919,22.319607
Q2101,天主教鳴遠中學,西貢區,Catholic Ming Yuen Secondary School,SAI KUNG DISTRICT,695,316,7,379,500,456,589,55,173,1209,18,184,361,282,5,17,36,546,515,3,273,177,6796,114.2642182,22.3178348
Q2201,港澳信義會慕德中學,西貢區,Hong Kong and Macau Lutheran Church Queen Maud Secondary School,SAI KUNG DISTRICT,810,348,6,245,360,473,645,115,174,1159,8,211,223,300,5,10,28,460,347,0,217,166,6310,114.267008,22.317501
Q2301,坑口社區會堂,西貢區,Hang Hau Community Hall,SAI KUNG DISTRICT,902,448,12,335,476,523,664,109,176,623,10,190,310,370,5,20,33,564,464,2,1067,159,7462,114.268333,22.317222
Q2401,尚德社區會堂,西貢區,Sheung Tak Community Hall,SAI KUNG DISTRICT,302,155,8,371,458,368,483,28,135,719,15,96,1087,286,6,17,28,513,923,4,136,79,6217,114.25663,22.311255
Q2501,香港道教聯合會圓玄學院第三中學,西貢區,HKTA The Yuen Yuen Institute No.3 Secondary School,SAI KUNG DISTRICT,520,357,7,257,387,429,625,62,225,1754,4,138,376,276,3,13,20,470,545,1,148,94,6711,114.2571295,22.311831
Q2601,啓思中學,西貢區,Creative Secondary School,SAI KUNG DISTRICT,570,100,3,74,114,206,211,46,46,193,1,69,40,88,1,5,2,157,83,0,61,39,2109,114.2677008,22.3073918
Q2602,康城社區會堂,西貢區,Lohas Park Community Hall,SAI KUNG DISTRICT,2458,322,7,263,308,488,707,97,126,875,4,220,161,377,0,20,23,605,361,0,265,158,7845,114.271944,22.295556
